label,explanation,exceptions,execution_status,execution_seconds,score
correct,"The agent's thought process aligns well with the user's query. The user wants to create a repository named after a Star Wars character, check if it already exists, and if not, create it. The agent plans to start by selecting a common Star Wars character name, 'r2d2', which is a logical choice given the lack of internet access to search for names. The agent also correctly outlines the subsequent steps: creating an issue for a README, committing the code and README, and closing the issue. This shows a clear understanding of the user's request and a logical approach to fulfilling it.",[],COMPLETED,3.32886004447937,1
correct,"The agent's thought is focused on checking if a repository name, specifically a Star Wars character, is available, which aligns with the user's request to create a repository with such a name. The user wants to ensure the repository doesn't already exist before proceeding, and the agent is attempting to find an available name, which is a logical step in fulfilling the user's request.",[],COMPLETED,2.685288190841675,1
correct,"The agent's thought is focused on selecting a name for the repository, which is a relevant part of the user's request. The user asked to create a repository named after a Star Wars character, and the agent is considering 'yoda-repository' as a potential name. This step is logical and necessary to ensure the repository name does not already exist, aligning with the user's instructions to check for existing repositories before creation.",[],COMPLETED,3.3282837867736816,1
correct,"The agent's thought is focused on finding a suitable name for the repository, which is a relevant part of the user's request. The user asked to create a repository named after a Star Wars character, and the agent is attempting to find an available name by checking existing repositories. This is a logical step toward fulfilling the user's request, as it addresses the first part of the task: ensuring the repository name does not already exist. Therefore, the agent's thought aligns with the user's query.",[],COMPLETED,2.616292953491211,1
correct,"The agent's thought is focused on creating a repository named ""grogu-calculator"" after checking if it already exists, which aligns with the user's request to create a repository named after a Star Wars character. However, the user did not specify the name ""grogu-calculator""; they only mentioned a Star Wars character. The agent's approach to check if the repository exists and then create it is logical, but the specific name choice is not directly derived from the user's query. Despite this, the agent is working on a relevant part of the task, which is the creation of the repository, and is taking a logical step toward completing the request.",[],COMPLETED,4.101875066757202,1
correct,"The agent's thought indicates that they have successfully created a repository named ""grogu-calculator"" and are now proceeding to create an issue for adding a README. This aligns with the user's request to create a repository named after a Star Wars character, check its existence, and then create an issue for adding a README. The agent is working on a relevant part of the task and is taking a logical step toward completing the user's request.",[],COMPLETED,3.5436007976531982,1
incorrect,"The agent's thought is focused on creating a placeholder `calculator.py` and a basic `README.md`, which aligns with the user's request to commit code and a README for a calculator. However, the user also requested to create a repository named after a Star Wars character and to ensure it doesn't already exist, which the agent's thought does not address. Additionally, the user asked to close the issue after committing the code and README, which the agent has not mentioned. Therefore, the agent's thought is incomplete and does not fully align with the user's query.",[],COMPLETED,2.653388023376465,0
incorrect,"The user's query involves several steps: creating a repository named after a Star Wars character, checking if it already exists, creating an issue for adding a README for a calculator, committing code and the README, and then closing the issue. The agent's current thought is focused on creating the `README.md`, which is a relevant part of the task. However, the thought does not address the initial steps of checking for the repository's existence or creating the repository and issue. Therefore, while the agent is working on a relevant part of the task, it is not addressing the user's request in the correct sequence or comprehensively.",[],COMPLETED,5.852982044219971,0
correct,"The agent's current thought is focused on closing the issue after adding the README.md, which is a part of the user's request. The user asked to create an issue for adding a README, commit the code and README, and then close the issue. The agent's thought about closing the issue after adding the README aligns with the user's request to close the issue after completing the task. Therefore, the agent is working on a relevant part of the task and taking a logical step toward completing the request.",[],COMPLETED,4.184428930282593,1
