label,explanation,exceptions,execution_status,execution_seconds,score
NOT_PARSABLE,"The sequence of steps taken by the multi-agent system is suboptimal for several reasons:

1. **Step 1 (SearchAgent)**: The initial step involves using the SearchAgent to check for existing repositories with Star Trek character names. However, the user request specifies creating a repository with a Battlestar Galactica character name unless a Star Trek character name already exists. The search should have been for Battlestar Galactica character names first, and only if a conflict was found, should the system have checked for Star Trek character names.

2. **Step 2 (RepoAgent)**: The system proceeds to create a repository without confirming the name of the Battlestar Galactica character to use. This could lead to an incorrect repository name being chosen.

3. **Step 5 (ContentAgent)**: The ContentAgent reached max iterations, indicating a failure in the process. This suggests that the task was not broken down effectively or that the agent was not used correctly.

4. **Overall Coordination**: The sequence of operations could have been more efficiently organized by ensuring that the repository name was correctly determined before proceeding with other tasks. Additionally, the failure in Step 5 indicates a lack of error handling or contingency planning.

Overall, the workflow could have been more efficiently organized, and the agents could have been used more effectively to handle the task. Therefore, the sequence is suboptimal.",[],COMPLETED,8.895911931991577,0
incorrect,"The sequence of steps taken by the multi-agent system is suboptimal. The initial step of creating a repository was correct, but the system failed to check if a repository with the name of a Star Trek character already existed before attempting to create a new one. This could lead to unnecessary attempts and errors. Additionally, the ContentAgent failed to commit the code and README in one step, which indicates a lack of proper task breakdown or error handling. The system had to retry by breaking down the task into smaller steps, which was inefficient. The order of operations was logical, but the execution was not efficient due to these issues.",[],COMPLETED,4.769672155380249,0
NOT_PARSABLE,"The sequence of steps taken by the multi-agent system is suboptimal. Initially, the system attempted to commit files to a repository that it could not find, which indicates a lack of verification of the repository's existence before attempting to update its contents. This led to multiple failed attempts (Steps 1 and 2) before the system decided to list the repository files to confirm the repository's existence and correct owner (Steps 3 and 4). This verification should have been the first step to avoid unnecessary attempts to update a non-existent repository. Additionally, the system did not initially verify the correct owner of the repository, leading to further unnecessary steps. Therefore, the workflow could have been more efficiently organized by verifying the repository's existence and ownership before attempting to update its contents.",[],COMPLETED,5.770969867706299,0
NOT_PARSABLE,"The multi-agent system's approach was suboptimal for several reasons. Firstly, there was a misunderstanding of the repository path, leading to multiple failed attempts to update the file content. The system initially attempted to create a README file but then shifted focus to committing a calculator implementation, which was not part of the user's original request. Additionally, the system repeatedly encountered a 'Not Found' error due to incorrect repository naming, indicating a lack of verification or confirmation of the repository's existence before attempting updates. The sequence of steps could have been more efficient if the system had verified the repository's existence and correct path before attempting to update files. Furthermore, the task of creating a README file was not completed as per the user's request, indicating a deviation from the original task. Therefore, the workflow was not efficiently organized, and the sequence of operations was not optimal.",[],COMPLETED,6.048735857009888,0
NOT_PARSABLE,"The multi-agent system did not specify the account under which the repository should be created. The user explicitly requested the repository to be created under the 'puranjaigarg783' account, but the tool call only included the repository name 'Starbuck' without mentioning the account. This omission could lead to the repository being created under a default or incorrect account, which is not what the user requested. Therefore, the sequence of steps was not optimal as it failed to fully address the user's query.",[],COMPLETED,3.34188175201416,0
NOT_PARSABLE,"The multi-agent system's approach is suboptimal because it only attempts to create a repository with the name 'Picard' without checking if a repository with that name already exists under the account. The user explicitly requested to choose a different Star Trek character name if a repository with the initial name already exists. The system should have first checked for the existence of a repository named 'Picard' before attempting to create it, and then proceeded to try another name if it was already taken. This would have avoided a potentially unnecessary step of attempting to create a repository with a name that might already exist.",[],COMPLETED,3.803098201751709,0
NOT_PARSABLE,"The sequence of steps taken by the multi-agent system is suboptimal. The task was to create an issue in a specific GitHub repository. However, the tool and agent delegation sequence shows an unnecessary step: 'close_issue' was called before 'create_issue'. The user did not request to close any issue, so this step is redundant and does not contribute to the task. The correct and efficient sequence should have directly involved the 'create_issue' tool to accomplish the user's request without any additional or unrelated actions. Therefore, the workflow could have been more efficiently organized by omitting the unnecessary 'close_issue' step.",[],COMPLETED,4.034849166870117,0
incorrect,"The task was to create an issue in a specific repository with a given title and body. The thought sequence and tool usage indicate that the system attempted to create an issue, which is correct. However, the second step involves closing an issue, which was not part of the user's request. This step is unnecessary and does not align with the user's task. Therefore, the sequence includes an unnecessary step, making it suboptimal.",[],COMPLETED,3.0896189212799072,0
NOT_PARSABLE,"The multi-agent system did not follow the optimal sequence of steps to accomplish the user's task. The user requested the creation of a README.md file with specific content in the puranjaigarg783/Starbuck repository. However, the system's thought sequence and tool usage included an unnecessary step of creating a calculator.py file, which was not part of the user's request. This indicates a misunderstanding or misexecution of the task, leading to redundant operations. Therefore, the workflow was not efficiently organized, and the sequence of operations was suboptimal.",[],COMPLETED,6.890743732452393,0
NOT_PARSABLE,"The sequence of steps taken by the multi-agent system is suboptimal. Initially, there was confusion about the repository owner, leading to unnecessary steps in confirming the repository's existence and ownership. The agent first attempted to list the files in the repository to confirm the correct name and owner, which was unnecessary if the correct information was initially used. Additionally, the agent attempted to update the file content multiple times due to the initial misunderstanding of the repository's ownership. These redundant steps could have been avoided with a more accurate initial understanding of the repository details. Therefore, the workflow was not efficiently organized, and the sequence of operations was not the most logical given the task requirements.",[],COMPLETED,4.1046271324157715,0
incorrect,"The sequence of steps taken by the multi-agent system is suboptimal. The user query was clear in specifying a search for a repository related to 'star trek character' by the user 'puranjaigarg783'. However, the system's approach involved multiple attempts with varying queries, which indicates inefficiency. The first step attempted to use both the username and keywords, which is appropriate, but the subsequent steps show a lack of clarity in refining the search. The second step repeats the first with a slight modification, and the third step abandons the keyword search entirely, which is not aligned with the user's request. This indicates unnecessary repetition and a lack of strategic refinement in the search process. Therefore, the workflow could have been more efficiently organized by refining the initial query based on the error feedback rather than removing essential components of the search.",[],COMPLETED,4.731656789779663,0
